titles,abstracts,terms
EC-Net: an Edge-aware Point set Consolidation Network,"Point clouds obtained from 3D scans are typically sparse, irregular, and
noisy, and required to be consolidated. In this paper, we present the first
deep learning based edge-aware technique to facilitate the consolidation of
point clouds. We design our network to process points grouped in local patches,
and train it to learn and help consolidate points, deliberately for edges. To
achieve this, we formulate a regression component to simultaneously recover 3D
point coordinates and point-to-edge distances from upsampled features, and an
edge-aware joint loss function to directly minimize distances from output
points to 3D meshes and to edges. Compared with previous neural network based
works, our consolidation is edge-aware. During the synthesis, our network can
attend to the detected sharp edges and enable more accurate 3D reconstructions.
Also, we trained our network on virtual scanned point clouds, demonstrated the
performance of our method on both synthetic and real point clouds, presented
various surface reconstruction results, and showed how our method outperforms
the state-of-the-arts.",cs
AGRNet: Adaptive Graph Representation Learning and Reasoning for Face Parsing,"Face parsing infers a pixel-wise label to each facial component, which has
drawn much attention recently. Previous methods have shown their success in
face parsing, which however overlook the correlation among facial components.
As a matter of fact, the component-wise relationship is a critical clue in
discriminating ambiguous pixels in facial area. To address this issue, we
propose adaptive graph representation learning and reasoning over facial
components, aiming to learn representative vertices that describe each
component, exploit the component-wise relationship and thereby produce accurate
parsing results against ambiguity. In particular, we devise an adaptive and
differentiable graph abstraction method to represent the components on a graph
via pixel-to-vertex projection under the initial condition of a predicted
parsing map, where pixel features within a certain facial region are aggregated
onto a vertex. Further, we explicitly incorporate the image edge as a prior in
the model, which helps to discriminate edge and non-edge pixels during the
projection, thus leading to refined parsing results along the edges. Then, our
model learns and reasons over the relations among components by propagating
information across vertices on the graph. Finally, the refined vertex features
are projected back to pixel grids for the prediction of the final parsing map.
To train our model, we propose a discriminative loss to penalize small
distances between vertices in the feature space, which leads to distinct
vertices with strong semantics. Experimental results show the superior
performance of the proposed model on multiple face parsing datasets, along with
the validation on the human parsing task to demonstrate the generalizability of
our model.",cs
Virtual Normal: Enforcing Geometric Constraints for Accurate and Robust Depth Prediction,"Monocular depth prediction plays a crucial role in understanding 3D scene
geometry. Although recent methods have achieved impressive progress in terms of
evaluation metrics such as the pixel-wise relative error, most methods neglect
the geometric constraints in the 3D space. In this work, we show the importance
of the high-order 3D geometric constraints for depth prediction. By designing a
loss term that enforces a simple geometric constraint, namely, virtual normal
directions determined by randomly sampled three points in the reconstructed 3D
space, we significantly improve the accuracy and robustness of monocular depth
estimation. Significantly, the virtual normal loss can not only improve the
performance of learning metric depth, but also disentangle the scale
information and enrich the model with better shape information. Therefore, when
not having access to absolute metric depth training data, we can use virtual
normal to learn a robust affine-invariant depth generated on diverse scenes. In
experiments, We show state-of-the-art results of learning metric depth on NYU
Depth-V2 and KITTI. From the high-quality predicted depth, we are now able to
recover good 3D structures of the scene such as the point cloud and surface
normal directly, eliminating the necessity of relying on additional models as
was previously done. To demonstrate the excellent generalizability of learning
affine-invariant depth on diverse data with the virtual normal loss, we
construct a large-scale and diverse dataset for training affine-invariant
depth, termed Diverse Scene Depth dataset (DiverseDepth), and test on five
datasets with the zero-shot test setting. Code is available at:
https://git.io/Depth",cs
CLIP-It! Language-Guided Video Summarization,"A generic video summary is an abridged version of a video that conveys the
whole story and features the most important scenes. Yet the importance of
scenes in a video is often subjective, and users should have the option of
customizing the summary by using natural language to specify what is important
to them. Further, existing models for fully automatic generic summarization
have not exploited available language models, which can serve as an effective
prior for saliency. This work introduces CLIP-It, a single framework for
addressing both generic and query-focused video summarization, typically
approached separately in the literature. We propose a language-guided
multimodal transformer that learns to score frames in a video based on their
importance relative to one another and their correlation with a user-defined
query (for query-focused summarization) or an automatically generated dense
video caption (for generic video summarization). Our model can be extended to
the unsupervised setting by training without ground-truth supervision. We
outperform baselines and prior work by a significant margin on both standard
video summarization datasets (TVSum and SumMe) and a query-focused video
summarization dataset (QFVS). Particularly, we achieve large improvements in
the transfer setting, attesting to our method's strong generalization
capabilities.",cs
EX2: Exploration with Exemplar Models for Deep Reinforcement Learning,"Deep reinforcement learning algorithms have been shown to learn complex tasks
using highly general policy classes. However, sparse reward problems remain a
significant challenge. Exploration methods based on novelty detection have been
particularly successful in such settings but typically require generative or
predictive models of the observations, which can be difficult to train when the
observations are very high-dimensional and complex, as in the case of raw
images. We propose a novelty detection algorithm for exploration that is based
entirely on discriminatively trained exemplar models, where classifiers are
trained to discriminate each visited state against all others. Intuitively,
novel states are easier to distinguish against other states seen during
training. We show that this kind of discriminative modeling corresponds to
implicit density estimation, and that it can be combined with count-based
exploration to produce competitive results on a range of popular benchmark
tasks, including state-of-the-art results on challenging egocentric
observations in the vizDoom benchmark.",cs
Attentive Relational Networks for Mapping Images to Scene Graphs,"Scene graph generation refers to the task of automatically mapping an image
into a semantic structural graph, which requires correctly labeling each
extracted object and their interaction relationships. Despite the recent
success in object detection using deep learning techniques, inferring complex
contextual relationships and structured graph representations from visual data
remains a challenging topic. In this study, we propose a novel Attentive
Relational Network that consists of two key modules with an object detection
backbone to approach this problem. The first module is a semantic
transformation module utilized to capture semantic embedded relation features,
by translating visual features and linguistic features into a common semantic
space. The other module is a graph self-attention module introduced to embed a
joint graph representation through assigning various importance weights to
neighboring nodes. Finally, accurate scene graphs are produced by the relation
inference module to recognize all entities and the corresponding relations. We
evaluate our proposed method on the widely-adopted Visual Genome Dataset, and
the results demonstrate the effectiveness and superiority of our model.",cs
Two-Bit Networks for Deep Learning on Resource-Constrained Embedded Devices,"With the rapid proliferation of Internet of Things and intelligent edge
devices, there is an increasing need for implementing machine learning
algorithms, including deep learning, on resource-constrained mobile embedded
devices with limited memory and computation power. Typical large Convolutional
Neural Networks (CNNs) need large amounts of memory and computational power,
and cannot be deployed on embedded devices efficiently. We present Two-Bit
Networks (TBNs) for model compression of CNNs with edge weights constrained to
(-2, -1, 1, 2), which can be encoded with two bits. Our approach can reduce the
memory usage and improve computational efficiency significantly while achieving
good performance in terms of classification accuracy, thus representing a
reasonable tradeoff between model size and performance.",cs
Adversarial Continual Learning,"Continual learning aims to learn new tasks without forgetting previously
learned ones. We hypothesize that representations learned to solve each task in
a sequence have a shared structure while containing some task-specific
properties. We show that shared features are significantly less prone to
forgetting and propose a novel hybrid continual learning framework that learns
a disjoint representation for task-invariant and task-specific features
required to solve a sequence of tasks. Our model combines architecture growth
to prevent forgetting of task-specific skills and an experience replay approach
to preserve shared skills. We demonstrate our hybrid approach is effective in
avoiding forgetting and show it is superior to both architecture-based and
memory-based approaches on class incrementally learning of a single dataset as
well as a sequence of multiple datasets in image classification. Our code is
available at
\url{https://github.com/facebookresearch/Adversarial-Continual-Learning}.",stat
Boundary-Aware 3D Object Detection from Point Clouds,"Currently, existing state-of-the-art 3D object detectors are in two-stage
paradigm. These methods typically comprise two steps: 1) Utilize region
proposal network to propose a fraction of high-quality proposals in a bottom-up
fashion. 2) Resize and pool the semantic features from the proposed regions to
summarize RoI-wise representations for further refinement. Note that these
RoI-wise representations in step 2) are considered individually as an
uncorrelated entry when fed to following detection headers. Nevertheless, we
observe these proposals generated by step 1) offset from ground truth somehow,
emerging in local neighborhood densely with an underlying probability.
Challenges arise in the case where a proposal largely forsakes its boundary
information due to coordinate offset while existing networks lack corresponding
information compensation mechanism. In this paper, we propose BANet for 3D
object detection from point clouds. Specifically, instead of refining each
proposal independently as previous works do, we represent each proposal as a
node for graph construction within a given cut-off threshold, associating
proposals in the form of local neighborhood graph, with boundary correlations
of an object being explicitly exploited. Besides, we devise a lightweight
Region Feature Aggregation Network to fully exploit voxel-wise, pixel-wise, and
point-wise feature with expanding receptive fields for more informative
RoI-wise representations. As of Apr. 17th, 2021, our BANet achieves on par
performance on KITTI 3D detection leaderboard and ranks $1^{st}$ on $Moderate$
difficulty of $Car$ category on KITTI BEV detection leaderboard. The source
code will be released once the paper is accepted.",cs
Color-based Segmentation of Sky/Cloud Images From Ground-based Cameras,"Sky/cloud images captured by ground-based cameras (a.k.a. whole sky imagers)
are increasingly used nowadays because of their applications in a number of
fields, including climate modeling, weather prediction, renewable energy
generation, and satellite communications. Due to the wide variety of cloud
types and lighting conditions in such images, accurate and robust segmentation
of clouds is challenging. In this paper, we present a supervised segmentation
framework for ground-based sky/cloud images based on a systematic analysis of
different color spaces and components, using partial least squares (PLS)
regression. Unlike other state-of-the-art methods, our proposed approach is
entirely learning-based and does not require any manually-defined parameters.
In addition, we release the Singapore Whole Sky IMaging SEGmentation Database
(SWIMSEG), a large database of annotated sky/cloud images, to the research
community.",cs
"Explainable, Stable, and Scalable Graph Convolutional Networks for Learning Graph Representation","The network embedding problem that maps nodes in a graph to vectors in
Euclidean space can be very useful for addressing several important tasks on a
graph. Recently, graph neural networks (GNNs) have been proposed for solving
such a problem. However, most embedding algorithms and GNNs are difficult to
interpret and do not scale well to handle millions of nodes. In this paper, we
tackle the problem from a new perspective based on the equivalence of three
constrained optimization problems: the network embedding problem, the trace
maximization problem of the modularity matrix in a sampled graph, and the
matrix factorization problem of the modularity matrix in a sampled graph. The
optimal solutions to these three problems are the dominant eigenvectors of the
modularity matrix. We proposed two algorithms that belong to a special class of
graph convolutional networks (GCNs) for solving these problems: (i) Clustering
As Feature Embedding GCN (CAFE-GCN) and (ii) sphere-GCN. Both algorithms are
stable trace maximization algorithms, and they yield good approximations of
dominant eigenvectors. Moreover, there are linear-time implementations for
sparse graphs. In addition to solving the network embedding problem, both
proposed GCNs are capable of performing dimensionality reduction. Various
experiments are conducted to evaluate our proposed GCNs and show that our
proposed GCNs outperform almost all the baseline methods. Moreover, CAFE-GCN
could be benefited from the labeled data and have tremendous improvements in
various performance metrics.",stat
Domain Adaptation for Time Series Forecasting via Attention Sharing,"Recent years have witnessed deep neural networks gaining increasing
popularity in the field of time series forecasting. A primary reason of their
success is their ability to effectively capture complex temporal dynamics
across multiple related time series. However, the advantages of these deep
forecasters only start to emerge in the presence of a sufficient amount of
data. This poses a challenge for typical forecasting problems in practice,
where one either has a small number of time series, or limited observations per
time series, or both. To cope with the issue of data scarcity, we propose a
novel domain adaptation framework, Domain Adaptation Forecaster (DAF), that
leverages the statistical strengths from another relevant domain with abundant
data samples (source) to improve the performance on the domain of interest with
limited data (target). In particular, we propose an attention-based shared
module with a domain discriminator across domains as well as private modules
for individual domains. This allows us to jointly train the source and target
domains by generating domain-invariant latent features while retraining
domain-specific features. Extensive experiments on various domains demonstrate
that our proposed method outperforms state-of-the-art baselines on synthetic
and real-world datasets.",stat
High dynamic range image forensics using cnn,"High dynamic range (HDR) imaging has recently drawn much attention in
multimedia community. In this paper, we proposed a HDR image forensics method
based on convolutional neural network (CNN).To our best knowledge, this is the
first time to apply deep learning method on HDR image forensics. The proposed
algorithm uses CNN to distinguish HDR images generated by multiple low dynamic
range (LDR) images from that expanded by single LDR image using inverse tone
mapping (iTM). To do this, we learn the change of statistical characteristics
extracted by the proposed CNN architectures and classify two kinds of HDR
images. Comparision results with some traditional statistical characteristics
shows efficiency of the proposed method in HDR image source identification.",cs
Comparing Deep Reinforcement Learning and Evolutionary Methods in Continuous Control,"Reinforcement Learning and the Evolutionary Strategy are two major approaches
in addressing complicated control problems. Both are strong contenders and have
their own devotee communities. Both groups have been very active in developing
new advances in their own domain and devising, in recent years, leading-edge
techniques to address complex continuous control tasks. Here, in the context of
Deep Reinforcement Learning, we formulate a parallelized version of the
Proximal Policy Optimization method and a Deep Deterministic Policy Gradient
method. Moreover, we conduct a thorough comparison between the state-of-the-art
techniques in both camps fro continuous control; evolutionary methods and Deep
Reinforcement Learning methods. The results show there is no consistent winner.",cs
I Want This Product but Different : Multimodal Retrieval with Synthetic Query Expansion,"This paper addresses the problem of media retrieval using a multimodal query
(a query which combines visual input with additional semantic information in
natural language feedback). We propose a SynthTriplet GAN framework which
resolves this task by expanding the multimodal query with a synthetically
generated image that captures semantic information from both image and text
input. We introduce a novel triplet mining method that uses a synthetic image
as an anchor to directly optimize for embedding distances of generated and
target images. We demonstrate that apart from the added value of retrieval
illustration with synthetic image with the focus on customization and user
feedback, the proposed method greatly surpasses other multimodal generation
methods and achieves state of the art results in the multimodal retrieval task.
We also show that in contrast to other retrieval methods, our method provides
explainable embeddings.",cs
DuctTake: Spatiotemporal Video Compositing,"DuctTake is a system designed to enable practical compositing of multiple
takes of a scene into a single video. Current industry solutions are based
around object segmentation, a hard problem that requires extensive manual input
and cleanup, making compositing an expensive part of the film-making process.
Our method instead composites shots together by finding optimal spatiotemporal
seams using motion-compensated 3D graph cuts through the video volume. We
describe in detail the required components, decisions, and new techniques that
together make a usable, interactive tool for compositing HD video, paying
special attention to running time and performance of each section. We validate
our approach by presenting a wide variety of examples and by comparing result
quality and creation time to composites made by professional artists using
current state-of-the-art tools.",cs
Learning and Reasoning with the Graph Structure Representation in Robotic Surgery,"Learning to infer graph representations and performing spatial reasoning in a
complex surgical environment can play a vital role in surgical scene
understanding in robotic surgery. For this purpose, we develop an approach to
generate the scene graph and predict surgical interactions between instruments
and surgical region of interest (ROI) during robot-assisted surgery. We design
an attention link function and integrate with a graph parsing network to
recognize the surgical interactions. To embed each node with corresponding
neighbouring node features, we further incorporate SageConv into the network.
The scene graph generation and active edge classification mostly depend on the
embedding or feature extraction of node and edge features from complex image
representation. Here, we empirically demonstrate the feature extraction methods
by employing label smoothing weighted loss. Smoothing the hard label can avoid
the over-confident prediction of the model and enhances the feature
representation learned by the penultimate layer. To obtain the graph scene
label, we annotate the bounding box and the instrument-ROI interactions on the
robotic scene segmentation challenge 2018 dataset with an experienced clinical
expert in robotic surgery and employ it to evaluate our propositions.",eess
Deep Face Video Inpainting via UV Mapping,"This paper addresses the problem of face video inpainting. Existing video
inpainting methods target primarily at natural scenes with repetitive patterns.
They do not make use of any prior knowledge of the face to help retrieve
correspondences for the corrupted face. They therefore only achieve sub-optimal
results, particularly for faces under large pose and expression variations
where face components appear very differently across frames. In this paper, we
propose a two-stage deep learning method for face video inpainting. We employ
3DMM as our 3D face prior to transform a face between the image space and the
UV (texture) space. In Stage I, we perform face inpainting in the UV space.
This helps to largely remove the influence of face poses and expressions and
makes the learning task much easier with well aligned face features. We
introduce a frame-wise attention module to fully exploit correspondences in
neighboring frames to assist the inpainting task. In Stage II, we transform the
inpainted face regions back to the image space and perform face video
refinement that inpaints any background regions not covered in Stage I and also
refines the inpainted face regions. Extensive experiments have been carried out
which show our method can significantly outperform methods based merely on 2D
information, especially for faces under large pose and expression variations.",cs
AutoDO: Robust AutoAugment for Biased Data with Label Noise via Scalable Probabilistic Implicit Differentiation,"AutoAugment has sparked an interest in automated augmentation methods for
deep learning models. These methods estimate image transformation policies for
train data that improve generalization to test data. While recent papers
evolved in the direction of decreasing policy search complexity, we show that
those methods are not robust when applied to biased and noisy data. To overcome
these limitations, we reformulate AutoAugment as a generalized automated
dataset optimization (AutoDO) task that minimizes the distribution shift
between test data and distorted train dataset. In our AutoDO model, we
explicitly estimate a set of per-point hyperparameters to flexibly change
distribution of train data. In particular, we include hyperparameters for
augmentation, loss weights, and soft-labels that are jointly estimated using
implicit differentiation. We develop a theoretical probabilistic interpretation
of this framework using Fisher information and show that its complexity scales
linearly with the dataset size. Our experiments on SVHN, CIFAR-10/100, and
ImageNet classification show up to 9.3% improvement for biased datasets with
label noise compared to prior methods and, importantly, up to 36.6% gain for
underrepresented SVHN classes.",cs
Diverse Semantic Image Synthesis via Probability Distribution Modeling,"Semantic image synthesis, translating semantic layouts to photo-realistic
images, is a one-to-many mapping problem. Though impressive progress has been
recently made, diverse semantic synthesis that can efficiently produce
semantic-level multimodal results, still remains a challenge. In this paper, we
propose a novel diverse semantic image synthesis framework from the perspective
of semantic class distributions, which naturally supports diverse generation at
semantic or even instance level. We achieve this by modeling class-level
conditional modulation parameters as continuous probability distributions
instead of discrete values, and sampling per-instance modulation parameters
through instance-adaptive stochastic sampling that is consistent across the
network. Moreover, we propose prior noise remapping, through linear
perturbation parameters encoded from paired references, to facilitate
supervised training and exemplar-based instance style control at test time.
Extensive experiments on multiple datasets show that our method can achieve
superior diversity and comparable quality compared to state-of-the-art methods.
Code will be available at \url{https://github.com/tzt101/INADE.git}",cs
